{
  "graph": {
    "id": "tdt4300_knowledge_graph_v1",
    "label": "TDT4300 Data Warehouse and Data Mining knowledge graph",
    "field": "data_warehouse_and_data_mining",
    "model": "directed_typed_multigraph",
    "design_notes": [
      "The graph follows the same item/edge/domain/view schema as the provided functional_analysis.json template.",
      "Definitions, algorithms, processes, schemas, measures, exam recipes, and query patterns are first-class nodes.",
      "Definitional dependencies differ from logical/algorithmic dependencies and pedagogical learning dependencies.",
      "Exam recipes are explicit application nodes connected to the concepts they require."
    ],
    "source_refs": {
      "course_plan": "2026-01-27-lecture-plan.pdf",
      "assignment_1": "Assignment_1_TDT4300.pdf",
      "assignment_2": "assignment_2_tdt4300.pdf",
      "assignment_3": "assignment3_report.pdf / Assignment 3 prompt",
      "assignment_4": "assignment_4_tdt4300.pdf",
      "assignment_5": "Assignment_5_TDT4300.pdf",
      "exam_set": "TDT4300 exams 2021-2025 spring/resit, questions and selected solutions",
      "primary_books": [
        "Han, Kamber, Pei: Data Mining: Concepts and Techniques, 3rd ed.",
        "Tan, Steinbach, Kumar: Introduction to Data Mining"
      ]
    },
    "items": [
      {
        "id": "tdt4300",
        "label": "Data Warehouse and Data Mining",
        "kind": "structure",
        "domain": "foundations_kdd_preprocessing",
        "statement": null,
        "formal_statement": null,
        "definition": "Course covering data warehousing, OLAP, preprocessing, association rules, clustering, classification, and web usage mining.",
        "intuition": "A practical exam course about modelling analytical data and applying core data mining algorithms.",
        "notation": null,
        "assumptions": [],
        "dependencies": {
          "definitional_dependency": [],
          "logical_dependency": [],
          "assumption_dependency": [],
          "construction_dependency": [],
          "notation_dependency": [],
          "pedagogical_dependency": [],
          "historical_dependency": []
        },
        "metadata": {
          "tags": ["course", "root"],
          "syllabus_priority": "core",
          "source": "Course plan Spring 2026",
          "exam_priority": null,
          "proof_required": false
        }
      },
      {
        "id": "data_mining",
        "label": "Data mining",
        "kind": "definition",
        "domain": "foundations_kdd_preprocessing",
        "statement": null,
        "formal_statement": null,
        "definition": "Extraction of useful, valid, and understandable patterns or models from data.",
        "intuition": "Turn stored data into patterns that can support decisions.",
        "notation": null,
        "assumptions": [],
        "dependencies": {
          "definitional_dependency": [],
          "logical_dependency": [],
          "assumption_dependency": [],
          "construction_dependency": [],
          "notation_dependency": [],
          "pedagogical_dependency": ["tdt4300"],
          "historical_dependency": []
        },
        "metadata": {
          "tags": ["data mining", "kdd"],
          "syllabus_priority": "core",
          "source": "Han/Tan curriculum",
          "exam_priority": null,
          "proof_required": false
        }
      },
      {
        "id": "knowledge_discovery_process",
        "label": "Knowledge Discovery Process (KDD)",
        "kind": "process",
        "domain": "foundations_kdd_preprocessing",
        "statement": "KDD consists of preprocessing, data mining, and post-processing.",
        "formal_statement": null,
        "definition": "The end-to-end workflow for converting raw data into useful knowledge.",
        "intuition": "Most work happens before the algorithm: clean, integrate, transform, mine, evaluate.",
        "notation": null,
        "assumptions": [],
        "dependencies": {
          "definitional_dependency": ["data_mining"],
          "logical_dependency": [],
          "assumption_dependency": [],
          "construction_dependency": [],
          "notation_dependency": [],
          "pedagogical_dependency": [],
          "historical_dependency": []
        },
        "metadata": {
          "tags": ["kdd", "preprocessing"],
          "syllabus_priority": "core",
          "source": "Exam 2024 spring solution",
          "exam_priority": "main_pattern",
          "proof_required": false
        }
      },
      {
        "id": "data_preprocessing",
        "label": "Data preprocessing",
        "kind": "process",
        "domain": "foundations_kdd_preprocessing",
        "statement": null,
        "formal_statement": null,
        "definition": "Cleaning, integration, transformation, reduction, discretization, and sampling applied before mining.",
        "intuition": "Make data valid and useful before trusting any model.",
        "notation": null,
        "assumptions": [],
        "dependencies": {
          "definitional_dependency": [],
          "logical_dependency": [],
          "assumption_dependency": [],
          "construction_dependency": [],
          "notation_dependency": [],
          "pedagogical_dependency": ["knowledge_discovery_process"],
          "historical_dependency": []
        },
        "metadata": {
          "tags": ["cleaning", "preprocessing"],
          "syllabus_priority": "core",
          "source": "Assignments/exams preprocessing sections",
          "exam_priority": null,
          "proof_required": false
        }
      },
      {
        "id": "data_quality",
        "label": "Data quality",
        "kind": "property",
        "domain": "foundations_kdd_preprocessing",
        "statement": null,
        "formal_statement": null,
        "definition": "Degree to which data is accurate, complete, consistent, relevant, and non-redundant.",
        "intuition": "Garbage in, garbage out.",
        "notation": null,
        "assumptions": [],
        "dependencies": {
          "definitional_dependency": ["data_preprocessing"],
          "logical_dependency": [],
          "assumption_dependency": [],
          "construction_dependency": [],
          "notation_dependency": [],
          "pedagogical_dependency": [],
          "historical_dependency": []
        },
        "metadata": {
          "tags": ["quality", "cleaning"],
          "syllabus_priority": "core",
          "source": "Tan chapter 2 / assignments",
          "exam_priority": null,
          "proof_required": false
        }
      },
      {
        "id": "missing_values",
        "label": "Missing values",
        "kind": "problem",
        "domain": "foundations_kdd_preprocessing",
        "statement": null,
        "formal_statement": null,
        "definition": "Absent attribute values requiring deletion, imputation, or model-aware handling.",
        "intuition": "Missingness can be noise or information; do not blindly fill it.",
        "notation": null,
        "assumptions": [],
        "dependencies": {
          "definitional_dependency": ["data_quality"],
          "logical_dependency": [],
          "assumption_dependency": [],
          "construction_dependency": [],
          "notation_dependency": [],
          "pedagogical_dependency": [],
          "historical_dependency": []
        },
        "metadata": {
          "tags": ["cleaning", "missing"],
          "syllabus_priority": "core",
          "source": "Preprocessing curriculum",
          "exam_priority": null,
          "proof_required": false
        }
      },
      {
        "id": "noise_outliers",
        "label": "Noise and outliers",
        "kind": "problem",
        "domain": "foundations_kdd_preprocessing",
        "statement": null,
        "formal_statement": null,
        "definition": "Noise is random error; outliers are observations far from the main pattern and may be valid.",
        "intuition": "Outliers are not automatically mistakes.",
        "notation": null,
        "assumptions": [],
        "dependencies": {
          "definitional_dependency": ["data_quality"],
          "logical_dependency": [],
          "assumption_dependency": [],
          "construction_dependency": [],
          "notation_dependency": [],
          "pedagogical_dependency": [],
          "historical_dependency": []
        },
        "metadata": {
          "tags": ["outlier", "noise"],
          "syllabus_priority": "core",
          "source": "Exam 2025 resit preprocessing",
          "exam_priority": "recurring",
          "proof_required": false
        }
      },
      {
        "id": "normalization",
        "label": "Normalization / scaling",
        "kind": "process",
        "domain": "foundations_kdd_preprocessing",
        "statement": null,
        "formal_statement": "min-max: x'=(x-min)/(max-min); z-score: z=(x-\\mu)/\\sigma.",
        "definition": "Transform numeric attributes to comparable ranges or distributions.",
        "intuition": "Prevents large-scale attributes from dominating distance-based algorithms.",
        "notation": null,
        "assumptions": [],
        "dependencies": {
          "definitional_dependency": ["data_preprocessing"],
          "logical_dependency": [],
          "assumption_dependency": [],
          "construction_dependency": [],
          "notation_dependency": [],
          "pedagogical_dependency": [],
          "historical_dependency": []
        },
        "metadata": {
          "tags": ["scaling", "distance"],
          "syllabus_priority": "core",
          "source": "Preprocessing curriculum",
          "exam_priority": null,
          "proof_required": false
        }
      },
      {
        "id": "discretization",
        "label": "Discretization",
        "kind": "process",
        "domain": "foundations_kdd_preprocessing",
        "statement": null,
        "formal_statement": null,